Zachowanie pieszego;Liczba wypadkow;Liczba zabitych;Liczba rannych;Liczba kolizji
Chodzenie nieprawidłową stroną drogi;103;23;80;84
Inne przyczyny;140;21;120;341
Leżenie, siedzenie, klęczenie, stanie na jezdni;129;70;59;43
Nieostrożne wejście na jezdnię: przed jadącym pojazdem;1031;148;906;1300
Nieostrożne wejście na jezdnię: zza pojazdu, przeszkody;241;14;232;276
Przekraczanie jezdni w miejscu niedozwolonym;262;53;212;261
Wejście na jezdnię przy czerwonym świetle;202;18;195;242
Zatrzymanie, cofnięcie się;11;1;10;10
Podsumowanie;2119;348;1814;2557
